{"causation_id":null,"event_id":"EV-RUN-R01-REAL-POLL-CLAIM-TASK-R01-PROBE","kind":"CLAIM_PROPOSED","observed_at":"2026-10-25T16:21:42Z","payload_sha256":"c975e4b7f6257fe2f09a922d9654eb4e3b0561faefe22ebfd565ec1b8e508407","producer":"WORKBUDDY_01","project_id":"AGL-R01-PROBE","raw_ref":"kaibahaha/xxsc@dev/agl-v4.2-workbuddy-adapters:","run_id":"RUN-R01-REAL-POLL","schema_version":"1.0","source":"github","spec_hash":"ffffffffffffffffffffffffffffffffffffffffffffffffffffffffffffffff","summary":"WORKBUDDY_01 proposes claim on TASK-R01-PROBE (soft claim, not a lease)","target_agents":["CONTROLLER"],"task_id":"TASK-R01-PROBE"}
