{"causation_id":null,"event_id":"EV-R01-COLLIDE-1","kind":"FACT_PUBLISHED","observed_at":"2026-10-25T16:20:00Z","payload_sha256":"2bd34b1b622755f99e9bc449d83f7986c7b57e0296825054b3f6647aa909eada","producer":"WORKBUDDY_01","project_id":"AGL-R01-PROBE","raw_ref":"kaibahaha/xxsc@dev/agl-v4.2-workbuddy-adapters:factory/agl/cli.py","run_id":"RUN-R01-COLLIDE","schema_version":"1.0","source":"github","spec_hash":"eeeeeeeeeeeeeeeeeeeeeeeeeeeeeeeeeeeeeeeeeeeeeeeeeeeeeeeeeeeeeeee","summary":"payload A","target_agents":["WORKBUDDY_01"],"task_id":"TASK-R01-PROBE"}
